{
  "$schema": "https://manifests.lumoria.dev/1/schemas/runner.json",
  "id": "wine-ge-custom",
  "name": "Wine-GE (deprecated 8.x)",
  "wine_arch": "win64",
  "support": "unsupported",
  "links": {
    "website": "https://github.com/GloriousEggroll/wine-ge-custom"
  },
  "messages": {
    "description": "Older Wine builds, such as the 8.x series. Prefer GE-Proton."
  },
  "sandbox_supported": false,
  "host_arches": [
    "x86_64"
  ],
  "github_repo": "GloriousEggroll/wine-ge-custom",
  "version_dir": "GE-Proton(.+)",
  "asset_regex": "wine-lutris-GE-Proton.*-x86_64\\.tar\\.xz$",
  "checksum_regex": "wine-lutris-GE-Proton.*-x86_64\\.sha512sum$",
  "wine_bin": "bin/wine",
  "wineserver": "bin/wineserver",
  "variants": [
    {
      "id": "wine-ge-custom",
      "label": "WoW64",
      "default": true,
      "wine_arch": "win64",
      "binary_kind": "wow64"
    },
    {
      "id": "win32",
      "label": "32-bit (legacy)",
      "wine_arch": "win32",
      "binary_kind": "legacy32"
    }
  ],
  "paths": {
    "bin": "bin",
    "lib": [
      "lib",
      "lib64"
    ],
    "lib_32": [
      "lib"
    ],
    "lib_64": [
      "lib64"
    ],
    "wine_dll": [
      "lib/wine",
      "lib/wine/i386-windows",
      "lib64/wine",
      "lib64/wine/x86_64-windows"
    ],
    "wine_unix": [
      "lib64/wine/x86_64-unix",
      "lib/wine/i386-unix"
    ]
  }
}
